{
  "schema_version": 1,
  "mode": "enabled",
  "default_state": "ACTIVE",
  "policy": {
    "path_match": "platform_aware_absolute_path_segment_boundary",
    "quarantine_scope": "directory_and_descendants",
    "quarantine_precedence": "DENY",
    "nested_activation_overrides_quarantined_parent": false,
    "activation_grants_write": false,
    "outside_project_root_requires_separate_scope_approval": true,
    "config_write_requires_separate_approval": true,
    "enforcement_status": "POLICY_ONLY_UNTIL_RUNTIME_OR_OS_ENFORCEMENT_IS_VERIFIED"
  },
  "entries": []
}
